locus_id,contig,ref_chr,chr_label,locus_start,locus_stop,motifs_present,projection_status,projection_confidence,projection_interval_width_bp,locus_tag,product,note,cds_start,cds_stop,distance_bp,overlaps_locus,within_projected_interval,is_essential
L1,contig_10,NC_006067.1,ChrA,112817,116516,"Hyg,MhFAR",paired_flanks_broad_interval,moderate,3700,YALI0_A00891g,YALI0A00891p,uniprot|Q96X25 Yarrowia lipolytica Serine/threonine phosphatase Pph21p (EC 3.1.3.16) (Serine/threonine protein phosphatase),112988,114379,0,False,True,False
L1,contig_10,NC_006067.1,ChrA,112817,116516,"Hyg,MhFAR",paired_flanks_broad_interval,moderate,3700,YALI0_A00913g,YALI0A00913p,weakly similar to uniprot|P40009 Saccharomyces cerevisiae YER005w YND1 Yeast Nucleoside Diphosphatase,116949,119207,433,False,False,False
L1,contig_10,NC_006067.1,ChrA,112817,116516,"Hyg,MhFAR",paired_flanks_broad_interval,moderate,3700,YALI0_A00869g,YALI0A00869p,some similarities with uniprot|P53322 Saccharomyces cerevisiae YGR260w TNA1 similarity to allantoate transport protein,109884,111338,1479,False,False,False
L1,contig_10,NC_006067.1,ChrA,112817,116516,"Hyg,MhFAR",paired_flanks_broad_interval,moderate,3700,YALI0_A00847g,YALI0A00847p,similar to uniprot|O59826 Schizosaccharomyces pombe Putative potassium channel subunit,108301,109344,3473,False,False,False
L1,contig_10,NC_006067.1,ChrA,112817,116516,"Hyg,MhFAR",paired_flanks_broad_interval,moderate,3700,YALI0_A00935g,YALI0A00935p,no similarity,121112,121432,4596,False,False,False
L1,contig_10,NC_006067.1,ChrA,112817,116516,"Hyg,MhFAR",paired_flanks_broad_interval,moderate,3700,YALI0_A00825g,YALI0A00825p,weakly similar to DEHA0E12342g Debaryomyces hansenii IPF 11939.1,106356,107765,5052,False,False,False
L1,contig_10,NC_006067.1,ChrA,112817,116516,"Hyg,MhFAR",paired_flanks_broad_interval,moderate,3700,YALI0_A00957g,YALI0A00957p,similar to Q8U8U2 Agrobacterium tumefaciens putative acetyl transferase,121983,122435,5467,False,False,False
L1,contig_10,NC_006067.1,ChrA,112817,116516,"Hyg,MhFAR",paired_flanks_broad_interval,moderate,3700,YALI0_A00979g,YALI0A00979p,similar to uniprot|P34240 Saccharomyces cerevisiae YKL175w ZRT3 vacuolar membrane protein involved in the regulation of zinc storage,124225,125673,7709,False,False,False
L1,contig_10,NC_006067.1,ChrA,112817,116516,"Hyg,MhFAR",paired_flanks_broad_interval,moderate,3700,YALI0_A00803g,YALI0A00803p,similar to uniprot|P39730 Saccharomyces cerevisiae YAL035w FUN12 general translation factor eIF2 homolog,100124,103264,9553,False,False,True
L1,contig_10,NC_006067.1,ChrA,112817,116516,"Hyg,MhFAR",paired_flanks_broad_interval,moderate,3700,YALI0_A01001g,YALI0A01001p,weakly similar to uniprot|P32341 Saccharomyces cerevisiae YKL119c VPH2 H+-ATPase assembly protein,127330,128412,10814,False,False,False
L1,contig_10,NC_006067.1,ChrA,112817,116516,"Hyg,MhFAR",paired_flanks_broad_interval,moderate,3700,YALI0_A00781g,YALI0A00781p,similar to uniprot|Q04004 Saccharomyces cerevisiae YDR183w PLP1 Phosducin homologue likely to be involved in regulation of pheromone response,94859,95452,17365,False,False,False
L1,contig_10,NC_006067.1,ChrA,112817,116516,"Hyg,MhFAR",paired_flanks_broad_interval,moderate,3700,YALI0_A00759g,YALI0A00759p,weakly similar to uniprot|P17442 Saccharomyces cerevisiae YGR233c PHO81 cyclin-dependent kinase inhibitor,91457,94501,18316,False,False,False
L2,contig_13,NC_006068.1,ChrB,764286,765333,"FAA1,FAT1,URA3",single_flank_fallback,low,1048,YALI0_B05632g,YALI0B05632p,weakly similar to uniprot|Q03338 Saccharomyces cerevisiae YDR473c PRP3 essential splicing factor,762310,763869,417,False,False,True
L2,contig_13,NC_006068.1,ChrB,764286,765333,"FAA1,FAT1,URA3",single_flank_fallback,low,1048,YALI0_B05654g,YALI0B05654p,uniprot|Q92389 Yarrowia lipolytica Acid extracellular protease precursor,766032,767225,699,False,False,False
L2,contig_13,NC_006068.1,ChrB,764286,765333,"FAA1,FAT1,URA3",single_flank_fallback,low,1048,YALI0_B05610g,YALI0B05610p,similar to uniprot|P38910 Saccharomyces cerevisiae YOR020C 10 kDa heat shock protein mitochondrial (HSP10) (10 kDa chaperonin,761588,762117,2169,False,False,True
L2,contig_13,NC_006068.1,ChrB,764286,765333,"FAA1,FAT1,URA3",single_flank_fallback,low,1048,YALI0_B05676g,YALI0B05676p,weakly similar to wi|NCU03885.1 Neurospora crassa NCU03885.1 predicted protein,768183,769904,2850,False,False,False
L2,contig_13,NC_006068.1,ChrB,764286,765333,"FAA1,FAT1,URA3",single_flank_fallback,low,1048,YALI0_B05566g,YALI0B05566p,some similarities with uniprot|Q12236 Saccharomyces cerevisiae YOL100w PKH2 related to ser/thr protein kinases P108.1.f16.1,756164,760878,3408,False,False,False
L2,contig_13,NC_006068.1,ChrB,764286,765333,"FAA1,FAT1,URA3",single_flank_fallback,low,1048,YALI0_B05698g,YALI0B05698p,some similarities with uniprot|Q8WXX7 Homo sapiens AUTS2 Autism susceptibility gene 2 protein,771767,772591,6434,False,False,False
L2,contig_13,NC_006068.1,ChrB,764286,765333,"FAA1,FAT1,URA3",single_flank_fallback,low,1048,YALI0_B05720g,YALI0B05720p,weakly similar to uniprot|Q03337 Saccharomyces cerevisiae YDR472w,773428,774273,8095,False,False,True
L2,contig_13,NC_006068.1,ChrB,764286,765333,"FAA1,FAT1,URA3",single_flank_fallback,low,1048,YALI0_B05742g,YALI0B05742p,similar to uniprot|P07347 Saccharomyces cerevisiae YHR013C N-terminal acetyltransferase complex ARD1 subunit (EC 2.3.1.-)(Arrest-defective protein 1),774503,775090,9170,False,False,False
L2,contig_13,NC_006068.1,ChrB,764286,765333,"FAA1,FAT1,URA3",single_flank_fallback,low,1048,YALI0_B05544g,YALI0B05544p,no similarity,752957,754162,10124,False,False,False
L2,contig_13,NC_006068.1,ChrB,764286,765333,"FAA1,FAT1,URA3",single_flank_fallback,low,1048,YALI0_B05764g,YALI0B05764p,weakly similar to uniprot|P38758 Saccharomyces cerevisiae YHR009C Hypothetical 57.0 kDa protein in SOD2-RPL27A intergenic region,776222,777424,10889,False,False,True
L2,contig_13,NC_006068.1,ChrB,764286,765333,"FAA1,FAT1,URA3",single_flank_fallback,low,1048,YALI0_B05522g,YALI0B05522p,similar to uniprot|Q96TK5 Coccidioides immitis Aspartyl aminopeptidase,751318,752748,11538,False,False,False
L2,contig_13,NC_006068.1,ChrB,764286,765333,"FAA1,FAT1,URA3",single_flank_fallback,low,1048,YALI0_B05500g,YALI0B05500p,similar to uniprot|Q9USW6 Schizosaccharomyces pombe dolichol phosphate-mannose biosynthesis regulatory protein,749975,750368,13918,False,False,False
L2,contig_13,NC_006068.1,ChrB,764286,765333,"FAA1,FAT1,URA3",single_flank_fallback,low,1048,YALI0_B05786g,YALI0B05786p,similar to uniprot|Q8X0S2 Neurospora crassa Related to syntaxin family member TLG1,780095,780754,14762,False,False,True
L2,contig_13,NC_006068.1,ChrB,764286,765333,"FAA1,FAT1,URA3",single_flank_fallback,low,1048,YALI0_B05808g,YALI0B05808p,similar to uniprot|P38276 Saccharomyces cerevisiae YBR137w,781153,781659,15820,False,False,False
L2,contig_13,NC_006068.1,ChrB,764286,765333,"FAA1,FAT1,URA3",single_flank_fallback,low,1048,YALI0_B05830g,YALI0B05830p,weakly similar to uniprot|Q10661 Caenorhabditis elegans Dosage compensation protein dpy-30 (Dumpty-30 protein),781839,782213,16506,False,False,False
L2,contig_13,NC_006068.1,ChrB,764286,765333,"FAA1,FAT1,URA3",single_flank_fallback,low,1048,YALI0_B05852g,YALI0B05852p,similar to uniprot|Q03327 Saccharomyces cerevisiae YDR470c,782916,784301,17583,False,False,True
L2,contig_13,NC_006068.1,ChrB,764286,765333,"FAA1,FAT1,URA3",single_flank_fallback,low,1048,YALI0_B05478g,YALI0B05478p,some similarities with uniprot|Q05937 Saccharomyces cerevisiae YLR375w STP3 involved in pre-tRNA splicing and in uptake of branched-chain amino acids,745387,746442,17844,False,False,False
L2,contig_13,NC_006068.1,ChrB,764286,765333,"FAA1,FAT1,URA3",single_flank_fallback,low,1048,YALI0_B05874g,YALI0B05874p,some similarities with uniprot|P25386 Saccharomyces cerevisiae YDL058w USO1 intracellular protein transport protein,784427,788420,19094,False,False,False
L3,contig_5,NC_006071.1,ChrE,3352038,3352050,"GFP,MhFAR",paired_flanks,high,13,YALI0_E28336g,YALI0E28336p,weakly similar to uniprot|Q08294 Saccharomyces cerevisiae YOL155c,3350786,3351745,293,False,False,False
L3,contig_5,NC_006071.1,ChrE,3352038,3352050,"GFP,MhFAR",paired_flanks,high,13,YALI0_E28358g,YALI0E28358p,similar to KLLA0C02277g Kluyveromyces lactis IPF 6652.1,3354406,3355785,2356,False,False,False
L3,contig_5,NC_006071.1,ChrE,3352038,3352050,"GFP,MhFAR",paired_flanks,high,13,YALI0_E28314g,YALI0E28314p,no similarity,3347966,3349402,2636,False,False,True
L3,contig_5,NC_006071.1,ChrE,3352038,3352050,"GFP,MhFAR",paired_flanks,high,13,YALI0_E28371g,YALI0E28371p,similar to uniprot|P46675 Saccharomyces cerevisiae YLR045c STU2 suppressor of a cs tubulin mutation,3356069,3358721,4019,False,False,True
L3,contig_5,NC_006071.1,ChrE,3352038,3352050,"GFP,MhFAR",paired_flanks,high,13,YALI0_E28292g,YALI0E28292p,similar to uniprot|Q10138 Schizosaccharomyces pombe Hypothetical protein C3H8.02 in chromosome I,3344531,3345901,6137,False,False,False
L3,contig_5,NC_006071.1,ChrE,3352038,3352050,"GFP,MhFAR",paired_flanks,high,13,YALI0_E28402g,YALI0E28402p,weakly similar to DEHA0G02266g Debaryomyces hansenii IPF 912.1,3359921,3362083,7871,False,False,True
L3,contig_5,NC_006071.1,ChrE,3352038,3352050,"GFP,MhFAR",paired_flanks,high,13,YALI0_E28270g,YALI0E28270p,similar to uniprot|P32331 Saccharomyces cerevisiae YPR058w YMC1 mitochondrial carrier protein (MCF),3342178,3343050,8988,False,False,False
L3,contig_5,NC_006071.1,ChrE,3352038,3352050,"GFP,MhFAR",paired_flanks,high,13,YALI0_E28424g,YALI0E28424p,similar to uniprot|Q02854 Neurospora crassa NADH-ubiquinone oxidoreductase 21 kDa subunit (Complex I),3362402,3363329,10352,False,False,False
L3,contig_5,NC_006071.1,ChrE,3352038,3352050,"GFP,MhFAR",paired_flanks,high,13,YALI0_E28446g,YALI0E28446p,some similarities with uniprot|Q04119 Saccharomyces cerevisiae YDR452w PHM5 similarity to human sphingomyelin phosphodiesterase,3363902,3365803,11852,False,False,False
L3,contig_5,NC_006071.1,ChrE,3352038,3352050,"GFP,MhFAR",paired_flanks,high,13,YALI0_E28259g,YALI0E28259p,some similarities with uniprot|Q6C7W6 Yarrowia lipolytica YALI0D24816g,3339212,3339472,12566,False,False,False
L3,contig_5,NC_006071.1,ChrE,3352038,3352050,"GFP,MhFAR",paired_flanks,high,13,YALI0_E28468g,YALI0E28468p,similar to uniprot|P46655 Saccharomyces cerevisiae YGL245w Glutamyl-tRNA synthetase cytoplasmic,3367060,3369162,15010,False,False,True
L3,contig_5,NC_006071.1,ChrE,3352038,3352050,"GFP,MhFAR",paired_flanks,high,13,YALI0_E28248g,YALI0E28248p,similar to uniprot|P20133 Saccharomyces cerevisiae YPR176c BET2 geranylgeranyltransferase type II beta subunit,3336046,3336879,15159,False,False,True
L3,contig_5,NC_006071.1,ChrE,3352038,3352050,"GFP,MhFAR",paired_flanks,high,13,YALI0_E28237g,YALI0E28237p,similar to uniprot|Q05567 Saccharomyces cerevisiae YDR294C,3334354,3335700,16338,False,False,False
L3,contig_5,NC_006071.1,ChrE,3352038,3352050,"GFP,MhFAR",paired_flanks,high,13,YALI0_E28490g,YALI0E28490p,similar to DEHA0F11572g Debaryomyces hansenii IPF 8214.1,3370075,3371124,18025,False,False,True
L3,contig_5,NC_006071.1,ChrE,3352038,3352050,"GFP,MhFAR",paired_flanks,high,13,YALI0_E28512g,YALI0E28512p,some similarities with DEHA0F18689g Debaryomyces hansenii IPF 7594.1 hypothical start,3371312,3373339,19262,False,False,False
L3,contig_5,NC_006071.1,ChrE,3352038,3352050,"GFP,MhFAR",paired_flanks,high,13,YALI0_E28226g,YALI0E28226p,similar to uniprot|P20053 Saccharomyces cerevisiae YPR178w PRP4 U4/U6 snRNP 52 KD protein,3331261,3332619,19419,False,False,True
L4,contig_8,NC_006071.1,ChrE,1902657,1904821,FAT1,paired_flanks_broad_interval,moderate,2165,YALI0_E16016g,YALI0E16016p,similar to uniprot|P38225 Saccharomyces cerevisiae YBR041w FAT1 very long-chain fatty acyl-CoA synthetase singleton,1902673,1904811,0,False,True,False
L4,contig_8,NC_006071.1,ChrE,1902657,1904821,FAT1,paired_flanks_broad_interval,moderate,2165,YALI0_E15994g,YALI0E15994p,weakly similar to uniprot|P40509 Saccharomyces cerevisiae YIL076w SEC28 epsilon-COP coatomer subunitt,1900823,1901350,1307,False,False,False
L4,contig_8,NC_006071.1,ChrE,1902657,1904821,FAT1,paired_flanks_broad_interval,moderate,2165,YALI0_E16038g,YALI0E16038p,similar to uniprot|Q00684 Saccharomyces cerevisiae YFR028c CDC14 dual specificity phosphatase,1907722,1909416,2901,False,False,False
L4,contig_8,NC_006071.1,ChrE,1902657,1904821,FAT1,paired_flanks_broad_interval,moderate,2165,YALI0_E15928g,YALI0E15928p,weakly similar to uniprot|P54791 Saccharomyces cerevisiae YPR162c ORC4 origin recognition complex 56 KD subunit,1898122,1899657,3000,False,False,True
L4,contig_8,NC_006071.1,ChrE,1902657,1904821,FAT1,paired_flanks_broad_interval,moderate,2165,YALI0_E15906g,YALI0E15906p,similar to uniprot|Q9UUK0 Schizosaccharomyces pombe Hypothetical 21.7 kDa protein,1896814,1897290,5367,False,False,False
L4,contig_8,NC_006071.1,ChrE,1902657,1904821,FAT1,paired_flanks_broad_interval,moderate,2165,YALI0_E15884g,YALI0E15884p,weakly similar to uniprot|O94329 Schizosaccharomyces pombe Hypothetical protein,1895725,1896492,6165,False,False,False
L4,contig_8,NC_006071.1,ChrE,1902657,1904821,FAT1,paired_flanks_broad_interval,moderate,2165,YALI0_E15862g,YALI0E15862p,no similarity,1892444,1893574,9083,False,False,False
L4,contig_8,NC_006071.1,ChrE,1902657,1904821,FAT1,paired_flanks_broad_interval,moderate,2165,YALI0_E16060g,YALI0E16060p,similar to uniprot|P39105 Saccharomyces cerevisiae YMR008c PLB1 phospholipase B (lysophospholipase),1913947,1915863,9126,False,False,False
L4,contig_8,NC_006071.1,ChrE,1902657,1904821,FAT1,paired_flanks_broad_interval,moderate,2165,YALI0_E15840g,YALI0E15840p,highly similar to uniprot|O93968 Candida boidinii Formate dehydrogenase,1891162,1892268,10389,False,False,False
L4,contig_8,NC_006071.1,ChrE,1902657,1904821,FAT1,paired_flanks_broad_interval,moderate,2165,YALI0_E16126g,YALI0E16126p,weakly similar to uniprot|P32317 Saccharomyces cerevisiae YEL052w AFG1 ATPase family gene,1917127,1919013,12306,False,False,False
L4,contig_8,NC_006071.1,ChrE,1902657,1904821,FAT1,paired_flanks_broad_interval,moderate,2165,YALI0_E15818g,YALI0E15818p,some similarities with uniprot|P10127 Saccharomyces cerevisiae YGL256w ADH4 alcohol dehydrogenase IV,1887434,1888912,13745,False,False,False
L4,contig_8,NC_006071.1,ChrE,1902657,1904821,FAT1,paired_flanks_broad_interval,moderate,2165,YALI0_E16148g,YALI0E16148p,no similarity,1919225,1920151,14404,False,False,True
L4,contig_8,NC_006071.1,ChrE,1902657,1904821,FAT1,paired_flanks_broad_interval,moderate,2165,YALI0_E15796g,YALI0E15796p,similar to uniprot|P38865 Saccharomyces cerevisiae YHR175w CTR2 copper transport protein,1886558,1887053,15604,False,False,False
L4,contig_8,NC_006071.1,ChrE,1902657,1904821,FAT1,paired_flanks_broad_interval,moderate,2165,YALI0_E16170g,YALI0E16170p,similar to uniprot|O74161 Candida albicans Chitin biosynthesis protein CHS5,1921357,1923063,16536,False,False,False
L4,contig_8,NC_006071.1,ChrE,1902657,1904821,FAT1,paired_flanks_broad_interval,moderate,2165,YALI0_E15752g,YALI0E15752p,no similarity possibly noncoding,1885474,1885569,17088,False,False,False
L4,contig_8,NC_006071.1,ChrE,1902657,1904821,FAT1,paired_flanks_broad_interval,moderate,2165,YALI0_E16192g,YALI0E16192p,highly similar to uniprot|Q9Y756 Neurospora crassa Vacuolar ATP synthase subunit F (EC 3.6.3.14) (V-ATPase F subunit) (Vacuolar proton pump F subunit) (V-ATPase 14 kDa subunit,1923298,1923722,18477,False,False,False
L4,contig_8,NC_006071.1,ChrE,1902657,1904821,FAT1,paired_flanks_broad_interval,moderate,2165,YALI0_E15730g,YALI0E15730p,similar to uniprot|P32476 Saccharomyces cerevisiae YGR175c ERG1 squalene monooxygenase,1882281,1883750,18907,False,False,True
L4,contig_8,NC_006071.1,ChrE,1902657,1904821,FAT1,paired_flanks_broad_interval,moderate,2165,YALI0_E16214g,YALI0E16214p,similar to uniprot|P53212 Saccharomyces cerevisiae YGR021w,1924751,1925626,19930,False,False,False
L5,contig_9,NC_006070.1,ChrD,2208054,2214070,FAA1,paired_flanks_broad_interval,moderate,6017,YALI0_D17842g,YALI0D17842p,weakly similar to uniprot|P53264 Saccharomyces cerevisiae YGR110w,2207968,2209437,0,False,True,False
L5,contig_9,NC_006070.1,ChrD,2208054,2214070,FAA1,paired_flanks_broad_interval,moderate,6017,YALI0_D17864g,YALI0D17864p,similar to uniprot|P30624 Saccharomyces cerevisiae YOR317w FAA1 long-chain-fatty-acid--CoA ligase,2210037,2212112,0,False,True,False
L5,contig_9,NC_006070.1,ChrD,2208054,2214070,FAA1,paired_flanks_broad_interval,moderate,6017,YALI0_D17820g,YALI0D17820p,no similarity,2203609,2206944,1110,False,False,False
L5,contig_9,NC_006070.1,ChrD,2208054,2214070,FAA1,paired_flanks_broad_interval,moderate,6017,YALI0_D17886g,YALI0D17886p,some similarities with uniprot|Q9UTK4 Schizosaccharomyces pombe Nucleoporin nup189 (Nuclear pore protein nup189),2217190,2221008,3120,False,False,False
L5,contig_9,NC_006070.1,ChrD,2208054,2214070,FAA1,paired_flanks_broad_interval,moderate,6017,YALI0_D17798g,YALI0D17798p,no similarity,2197955,2198605,9449,False,False,False
L5,contig_9,NC_006070.1,ChrD,2208054,2214070,FAA1,paired_flanks_broad_interval,moderate,6017,YALI0_D17930g,YALI0D17930p,highly similar to uniprot|P28777 Saccharomyces cerevisiae YGL148w ARO2 chorismate synthase,2224508,2225635,10438,False,False,True
L5,contig_9,NC_006070.1,ChrD,2208054,2214070,FAA1,paired_flanks_broad_interval,moderate,6017,YALI0_D17952g,YALI0D17952p,weakly similar to uniprot|P36057 Saccharomyces cerevisiae YKL154w SRP102 signal recognition particle receptor beta chain,2226652,2227434,12582,False,False,True
L5,contig_9,NC_006070.1,ChrD,2208054,2214070,FAA1,paired_flanks_broad_interval,moderate,6017,YALI0_D17974g,YALI0D17974p,weakly similar to uniprot|P53389 Saccharomyces cerevisiae YNR055c HOL1 member of major facilitator superfamily multidrug-resistance,2227743,2229365,13673,False,False,False
L5,contig_9,NC_006070.1,ChrD,2208054,2214070,FAA1,paired_flanks_broad_interval,moderate,6017,YALI0_D17988g,YALI0D17988p,weakly similar to uniprot|Q7SHK8 Neurospora crassa NCU02896.1 hypothetical protein hyothetical start,2230540,2233188,16470,False,False,True
L5,contig_9,NC_006070.1,ChrD,2208054,2214070,FAA1,paired_flanks_broad_interval,moderate,6017,YALI0_D17776g,YALI0D17776p,similar to uniprot|P38153 Saccharomyces cerevisiae YBR288c APM3 AP-3 Adaptin complex subunit mu3 subunit,2187763,2188953,19101,False,False,True
L6,contig_9,NC_006070.1,ChrD,1675540,1683306,"GFP,WS",paired_flanks_broad_interval,moderate,7767,YALI0_D13552g,YALI0D13552p,weakly similar to uniprot|Q12361 Saccharomyces cerevisiae YDL035c GPR1 G-protein coupled receptor,1675257,1676798,0,False,True,False
L6,contig_9,NC_006070.1,ChrD,1675540,1683306,"GFP,WS",paired_flanks_broad_interval,moderate,7767,YALI0_D13574g,YALI0D13574p,similar to uniprot|Q12367 Saccharomyces cerevisiae YLR137w,1676952,1677872,0,False,True,False
L6,contig_9,NC_006070.1,ChrD,1675540,1683306,"GFP,WS",paired_flanks_broad_interval,moderate,7767,YALI0_D13596g,YALI0D13596p,highly similar to uniprot|P13663 Saccharomyces cerevisiae YDR158w HOM2 aspartate-semialdehyde dehydrogenase,1679447,1680541,0,False,True,True
L6,contig_9,NC_006070.1,ChrD,1675540,1683306,"GFP,WS",paired_flanks_broad_interval,moderate,7767,YALI0_D13618g,YALI0D13618p,no similarity,1681130,1683919,0,False,True,False
L6,contig_9,NC_006070.1,ChrD,1675540,1683306,"GFP,WS",paired_flanks_broad_interval,moderate,7767,YALI0_D13640g,YALI0D13640p,similar to uniprot|P38887 Saccharomyces cerevisiae YHR202w,1684342,1686063,1036,False,False,False
L6,contig_9,NC_006070.1,ChrD,1675540,1683306,"GFP,WS",paired_flanks_broad_interval,moderate,7767,YALI0_D13530g,YALI0D13530p,no similarity,1670543,1671691,3849,False,False,False
L6,contig_9,NC_006070.1,ChrD,1675540,1683306,"GFP,WS",paired_flanks_broad_interval,moderate,7767,YALI0_D13662g,YALI0D13662p,no similarity,1688736,1689131,5430,False,False,False
L6,contig_9,NC_006070.1,ChrD,1675540,1683306,"GFP,WS",paired_flanks_broad_interval,moderate,7767,YALI0_D13684g,YALI0D13684p,some similarities with uniprot|P17121 Saccharomyces cerevisiae YDR389W GTPase activating protein SAC7,1689863,1693037,6557,False,False,False
L6,contig_9,NC_006070.1,ChrD,1675540,1683306,"GFP,WS",paired_flanks_broad_interval,moderate,7767,YALI0_D13508g,YALI0D13508p,similar to uniprot|Q03768 Saccharomyces cerevisiae YDR152w,1667538,1668209,7331,False,False,False
L6,contig_9,NC_006070.1,ChrD,1675540,1683306,"GFP,WS",paired_flanks_broad_interval,moderate,7767,YALI0_D13486g,YALI0D13486p,similar to DEHA0E17215g Debaryomyces hansenii,1665804,1666835,8705,False,False,True
L6,contig_9,NC_006070.1,ChrD,1675540,1683306,"GFP,WS",paired_flanks_broad_interval,moderate,7767,YALI0_D13464g,YALI0D13464p,similar to uniprot|Q04500 Saccharomyces cerevisiae YML093w,1662360,1665272,10268,False,False,True
L6,contig_9,NC_006070.1,ChrD,1675540,1683306,"GFP,WS",paired_flanks_broad_interval,moderate,7767,YALI0_D13706g,YALI0D13706p,similar to uniprot|P39743 Saccharomyces cerevisiae YDR388w RVS167 Reduced viability upon starvation,1696507,1697760,13201,False,False,False
L6,contig_9,NC_006070.1,ChrD,1675540,1683306,"GFP,WS",paired_flanks_broad_interval,moderate,7767,YALI0_D13442g,YALI0D13442p,similar to |P47160 uniprot|P47160 Saccharomyces cerevisiae YJR125c ENT3 cytoskeletal adaptor P3.83.f3.1 and Schizosaccharomyces pombe Hypothetical 51.8 kDa protein,1660515,1662014,13526,False,False,False
L6,contig_9,NC_006070.1,ChrD,1675540,1683306,"GFP,WS",paired_flanks_broad_interval,moderate,7767,YALI0_D13288g,YALI0D13288p,no similarity possibly noncoding,1655726,1656340,19200,False,False,False
L6,contig_9,NC_006070.1,ChrD,1675540,1683306,"GFP,WS",paired_flanks_broad_interval,moderate,7767,YALI0_D13728g,40S ribosomal protein S24,similar to uniprot|P26782 Saccharomyces cerevisiae YIL069c RP50B 40S small subunit ribosomal protein S24.e,1702673,1703385,19367,False,False,False
L6,contig_9,NC_006070.1,ChrD,1675540,1683306,"GFP,WS",paired_flanks_broad_interval,moderate,7767,YALI0_D13266g,YALI0D13266p,no similarity,1654046,1655542,19998,False,False,False
L7,contig_9,NC_006070.1,ChrD,1632503,1640142,"GFP,MhFAR",paired_flanks_broad_interval,moderate,7640,YALI0_D13156g,YALI0D13156p,weakly similar to uniprot|P38966 Saccharomyces cerevisiae YDR089w,1636710,1639313,0,False,True,False
L7,contig_9,NC_006070.1,ChrD,1632503,1640142,"GFP,MhFAR",paired_flanks_broad_interval,moderate,7640,YALI0_D13178g,YALI0D13178p,similar to uniprot|Q12509 Saccharomyces cerevisiae YLR085c ARP6 Actin-related protein P8.3.f5.1,1641547,1642710,1405,False,False,False
L7,contig_9,NC_006070.1,ChrD,1632503,1640142,"GFP,MhFAR",paired_flanks_broad_interval,moderate,7640,YALI0_D13134g,YALI0D13134p,similar to uniprot|P43557 Saccharomyces cerevisiae YFL046w,1630419,1631072,1431,False,False,True
L7,contig_9,NC_006070.1,ChrD,1632503,1640142,"GFP,MhFAR",paired_flanks_broad_interval,moderate,7640,YALI0_D13112g,YALI0D13112p,highly similar to uniprot|P31353 Candida albicans Phosphomannomutase SEC53 (PMM),1628665,1629426,3077,False,False,True
L7,contig_9,NC_006070.1,ChrD,1632503,1640142,"GFP,MhFAR",paired_flanks_broad_interval,moderate,7640,YALI0_D13200g,YALI0D13200p,no similarity,1643342,1643776,3200,False,False,False
L7,contig_9,NC_006070.1,ChrD,1632503,1640142,"GFP,MhFAR",paired_flanks_broad_interval,moderate,7640,YALI0_D13104g,60S ribosomal protein L10,similar to uniprot|P41805 Saccharomyces cerevisiae YLR075w GRC5 60S large subunit ribosomal protein,1624914,1625579,6924,False,False,False
L7,contig_9,NC_006070.1,ChrD,1632503,1640142,"GFP,MhFAR",paired_flanks_broad_interval,moderate,7640,YALI0_D13090g,YALI0D13090p,similar to uniprot|Q12017 Saccharomyces cerevisiae YOR281c PLP2 IAP-associated factor Viaf1,1622401,1623270,9233,False,False,True
L7,contig_9,NC_006070.1,ChrD,1632503,1640142,"GFP,MhFAR",paired_flanks_broad_interval,moderate,7640,YALI0_D13068g,YALI0D13068p,similar to uniprot|Q08004 Saccharomyces cerevisiae Chromosome XII reading frame ORF YLR074C zinc finger protein,1619757,1620257,12246,False,False,False
L7,contig_9,NC_006070.1,ChrD,1632503,1640142,"GFP,MhFAR",paired_flanks_broad_interval,moderate,7640,YALI0_D13255g,YALI0D13255p,no similarity,1652808,1653938,12666,False,False,False
L7,contig_9,NC_006070.1,ChrD,1632503,1640142,"GFP,MhFAR",paired_flanks_broad_interval,moderate,7640,YALI0_D13266g,YALI0D13266p,no similarity,1654046,1655542,13904,False,False,False
L7,contig_9,NC_006070.1,ChrD,1632503,1640142,"GFP,MhFAR",paired_flanks_broad_interval,moderate,7640,YALI0_D13046g,YALI0D13046p,similar to |P43558 uniprot|P43558 Saccharomyces cerevisiae YFL044c and Schizosaccharomyces pombe Hypothetical zinc finger protein,1616995,1617972,14531,False,False,False
L7,contig_9,NC_006070.1,ChrD,1632503,1640142,"GFP,MhFAR",paired_flanks_broad_interval,moderate,7640,YALI0_D13288g,YALI0D13288p,no similarity possibly noncoding,1655726,1656340,15584,False,False,False
L7,contig_9,NC_006070.1,ChrD,1632503,1640142,"GFP,MhFAR",paired_flanks_broad_interval,moderate,7640,YALI0_D13024g,YALI0D13024p,similar to uniprot|Q96WJ7 Blumeria graminis Glutamine synthetase (EC 6.3.1.2) (Glutamate--ammonia ligase),1614808,1616184,16319,False,False,False
